{
  "artifacts" : [],
  "completed_at" : "2026-09-13T08:41:20Z",
  "duration_ms" : 0,
  "errors" : 
  [
    {
      "code" : "JOB_NOT_STARTABLE",
      "ir_coordinate" : "",
      "log_line" : 0,
      "severity" : "error",
      "stage" : "Validating",
      "summary" : "Concurrency limit reached for simulation; job remains queued."
    }
  ],
  "exit_code" : 0,
  "job_id" : "20260913T164120-000001",
  "job_type" : "simulation",
  "schema_version" : "1.0",
  "started_at" : "2026-09-13T08:41:20Z",
  "state" : "Failed",
  "summary" : "Failed"
}
